{
  "$schema": "./auth-support.schema.json",
  "schemaVersion": "1.0.0",
  "capturedAt": "2026-08-11T20:30:00+07:00",
  "releaseTrainId": "oc-2026.7.1-2-locked.1",
  "defaultPolicy": {
    "unknownAuthMode": "blocked",
    "silentFallback": false,
    "productionEnablementRequires": [
      "Upstream route documented for the locked release train",
      "Provider terms reviewed near release",
      "Dedicated test account live probe passed",
      "Revoke and disconnect flow verified",
      "Secret does not reach renderer, command line, logs or support bundle"
    ]
  },
  "records": [
    {
      "id": "openai.api-key",
      "provider": "openai",
      "authMode": "api-key",
      "supportLevel": "production",
      "readiness": "documented-only",
      "credentialOwner": "customer",
      "storageAuthority": "os-key-store-via-secretref",
      "source": { "path": "docs/providers/openai.md", "surface": "OpenAI API-key auth profile" },
      "termsCheckedAt": null,
      "platformsTested": [],
      "liveProbe": "required",
      "revokeFlow": "required",
      "enablementGate": "Feature 0.5 SecretRef contract plus Feature 1.4 live auth",
      "userLabelVi": "Khóa API OpenAI — khuyến nghị cho chi phí theo lượt dùng",
      "failureBehavior": "Giữ kết nối tắt; không lưu plaintext và không chuyển sang OAuth hoặc provider khác.",
      "risks": ["SecretRef broker chưa có contract test ba hệ điều hành", "Chi phí phát sinh theo tài khoản khách"]
    },
    {
      "id": "openai.codex-oauth",
      "provider": "openai",
      "authMode": "oauth",
      "supportLevel": "production",
      "readiness": "documented-only",
      "credentialOwner": "openclaw-profile",
      "storageAuthority": "openclaw-native-auth-store",
      "source": { "path": "docs/providers/openai.md", "surface": "ChatGPT/Codex subscription OAuth" },
      "termsCheckedAt": null,
      "platformsTested": [],
      "liveProbe": "required",
      "revokeFlow": "required",
      "enablementGate": "Feature 1.4 dedicated test account end-to-end",
      "userLabelVi": "Đăng nhập ChatGPT/Codex",
      "failureBehavior": "Hủy phiên OAuth và state tạm; tạo phiên mới khi thử lại, không yêu cầu sao chép callback.",
      "risks": ["OAuth token nằm trong auth store native của OpenClaw", "Quyền và quota phụ thuộc tài khoản khách"]
    },
    {
      "id": "openai.codex-device-code",
      "provider": "openai",
      "authMode": "device-code",
      "supportLevel": "conditional",
      "readiness": "documented-only",
      "credentialOwner": "openclaw-profile",
      "storageAuthority": "openclaw-native-auth-store",
      "source": { "path": "docs/providers/openai.md", "surface": "Codex device-code flow for callback-hostile setups" },
      "termsCheckedAt": null,
      "platformsTested": [],
      "liveProbe": "required",
      "revokeFlow": "required",
      "enablementGate": "Feature 1.4 device-code test on supported platforms",
      "userLabelVi": "Đăng nhập bằng mã thiết bị — dùng khi trình duyệt không quay lại ứng dụng",
      "failureBehavior": "Hết hạn mã và bắt đầu phiên mới; không tái sử dụng code hoặc state cũ.",
      "risks": ["Phishing mã thiết bị", "Người dùng có thể đăng nhập nhầm tài khoản"]
    },
    {
      "id": "anthropic.api-key",
      "provider": "anthropic",
      "authMode": "api-key",
      "supportLevel": "production",
      "readiness": "documented-only",
      "credentialOwner": "customer",
      "storageAuthority": "os-key-store-via-secretref",
      "source": { "path": "docs/providers/anthropic.md", "surface": "Anthropic direct API-key route" },
      "termsCheckedAt": null,
      "platformsTested": [],
      "liveProbe": "required",
      "revokeFlow": "required",
      "enablementGate": "Feature 0.5 SecretRef contract plus connector live test",
      "userLabelVi": "Khóa API Anthropic — khuyến nghị cho vận hành ổn định",
      "failureBehavior": "Giữ kết nối tắt; không chuyển sang Claude CLI hoặc model khác âm thầm.",
      "risks": ["SecretRef broker chưa được chứng minh", "Chi phí sử dụng API thuộc tài khoản khách"]
    },
    {
      "id": "anthropic.claude-cli",
      "provider": "anthropic",
      "authMode": "cli-credential",
      "supportLevel": "conditional",
      "readiness": "documented-only",
      "credentialOwner": "external-cli",
      "storageAuthority": "external-cli-store",
      "source": { "path": "docs/providers/anthropic.md", "surface": "reuse existing Claude Code CLI login" },
      "termsCheckedAt": null,
      "platformsTested": [],
      "liveProbe": "required",
      "revokeFlow": "required",
      "enablementGate": "Terms recheck, Claude CLI compatibility and dedicated-account live test",
      "userLabelVi": "Claude Pro/Max qua Claude Code — có điều kiện",
      "failureBehavior": "Báo rõ dependency hoặc điều khoản không đạt; không lấy API key làm fallback.",
      "risks": ["Điều khoản và cơ chế billing có thể đổi ngoài nhịp OpenClaw", "Phụ thuộc Claude CLI đã cài và đăng nhập trên host"]
    },
    {
      "id": "google.gemini-api-key",
      "provider": "google",
      "authMode": "api-key",
      "supportLevel": "production",
      "readiness": "documented-only",
      "credentialOwner": "customer",
      "storageAuthority": "os-key-store-via-secretref",
      "source": { "path": "docs/providers/google.md", "surface": "Gemini API-key route" },
      "termsCheckedAt": null,
      "platformsTested": [],
      "liveProbe": "required",
      "revokeFlow": "required",
      "enablementGate": "Feature 0.5 SecretRef contract plus connector live test",
      "userLabelVi": "Khóa API Gemini — khuyến nghị",
      "failureBehavior": "Giữ kết nối tắt; không tự chuyển sang Gemini CLI OAuth.",
      "risks": ["SecretRef broker chưa được chứng minh", "Quota và vùng phục vụ phụ thuộc dự án Google của khách"]
    },
    {
      "id": "google.gemini-cli-oauth",
      "provider": "google",
      "authMode": "cli-credential",
      "supportLevel": "experimental",
      "readiness": "blocked",
      "credentialOwner": "external-cli",
      "storageAuthority": "external-cli-store",
      "source": { "path": "docs/providers/google.md", "surface": "Gemini CLI OAuth integration" },
      "termsCheckedAt": null,
      "platformsTested": [],
      "liveProbe": "required",
      "revokeFlow": "required",
      "enablementGate": "Explicit Product Owner approval after provider-terms and account-risk review",
      "userLabelVi": "Gemini CLI OAuth — thử nghiệm",
      "failureBehavior": "Ẩn trong chế độ Cơ bản và giữ bị chặn; không hướng người dùng lách điều khoản.",
      "risks": ["Tích hợp không chính thức", "Nguy cơ provider hạn chế tài khoản hoặc thay đổi flow"]
    },
    {
      "id": "generic.plugin-owned",
      "provider": "generic-provider",
      "authMode": "plugin-owned",
      "supportLevel": "conditional",
      "readiness": "blocked",
      "credentialOwner": "plugin",
      "storageAuthority": "plugin-defined",
      "source": { "path": "docs/plugins/sdk-provider-plugins.md", "surface": "provider plugin authentication contract" },
      "termsCheckedAt": null,
      "platformsTested": [],
      "liveProbe": "required",
      "revokeFlow": "required",
      "enablementGate": "Plugin provenance, permission, terms and connector contract tests",
      "userLabelVi": "Nhà cung cấp mở rộng — cần kiểm tra plugin",
      "failureBehavior": "Quarantine connector không xác minh; không suy diễn OAuth chỉ vì provider có trang đăng nhập.",
      "risks": ["Plugin có thể giữ secret theo cách riêng", "Schema, quyền hoặc điều khoản có thể drift"]
    },
    {
      "id": "local.model-no-auth",
      "provider": "local-model",
      "authMode": "none-local",
      "supportLevel": "conditional",
      "readiness": "documented-only",
      "credentialOwner": "none",
      "storageAuthority": "none",
      "source": { "path": "docs/gateway/local-models.md", "surface": "local model service integration" },
      "termsCheckedAt": null,
      "platformsTested": [],
      "liveProbe": "required",
      "revokeFlow": "not-applicable",
      "enablementGate": "Per-model runtime, hardware and network-boundary test",
      "userLabelVi": "Mô hình cục bộ — tùy cấu hình máy",
      "failureBehavior": "Báo thiếu runtime hoặc tài nguyên; không biến yêu cầu local model thành sàn cho cloud mode.",
      "risks": ["Yêu cầu phần cứng phụ thuộc từng model", "Local service có thể nghe trên interface không an toàn"]
    }
  ]
}
